,Ingredients,Cuisine
749,potatoes scrubbed butter milk want rich use milk cream peas spring onions chopped chopped parsley salt freshly ground black pepper,17
750,red peppers butter potatoes peeled chopped cubes onions finely chopped salt freshly ground pepper homemade chicken stock vegetable stock creamy milk sprigs flatleaf parsley roasted chillies optional,17
751,butter potatoes peeled diced onions diced homemade chicken stock vegetable stock creamy milk salt freshly ground black pepper freshly chopped herbs garnish optional,17
752,butter caster sugar eggs preferably free range white flour preferably unbleached red rhubarb sliced thick sugar caster sugar sprinkling softly whipped cream barbados sugar,17
753,beef fillet trimmed one piece olive oil cracked black peppercorns mixed salad leaves serve tablespoon snipped fresh chives garnish fresh chervil leaves garnish celery sticks cut diagonally slices olive oil salt cracked black peppercorns cashel blue cheese crumbled makes use salt freshly ground black pepper dijon mustard white wine vinegar light olive oil,17
754,plain flour plus extra dusting wholemeal flour bicarbonate soda salt butter melted black treacle buttermilk alternatively use warm milk plus lemon juice,17
755,selfraising white flour plus extra dusting rolling wholemeal flour soft brown sugar bicarbonate soda flaked sea salt fullfat natural yoghurt fullfat milk plus extra glazing,17
756,vegetable oil greasing plain flour plus extra dusting bicarbonate soda salt wholemeal flour plus extra dusting dark brown sugar pint stout buttermilk,17
757,plain white flour bicarbonate soda cream tartar sea salt sugar buttermilk butter plus extra serve mashed potato plain flour plus extra dusting salt taste beef pork sausages ripe tomatoes cut half button mushrooms cleaned olive oil salt freshly ground black pepper slices readymade black pudding rashers smoked bacon freerange eggs,17
758,scrag end neck lamb bone carrots onion celery sticks leek garlic cloves crushed bay leaf sprig fresh thyme sea salt freshly ground black pepper carrots baby pickling onions floury potato weight peeled diced finely spring onions thinly sliced little fresh chopped parsley,17
759,big knobs butter glug olive oil onions cut various sizes cloves garlic crushed potatoes cut various sizes lamb chops excess fat trimmed reserved thick neck chops best go butcher salt freshly ground black pepper pint goodquality lamb stock chopped parsley optional,17
760,plain mashed potato still hot kale savoy cabbage cooked chopped carrots peeled cooked roughly mashed double cream milk spring onions sliced butter melted,17
761,pints whole milk short grain pudding rice butter caster sugar vanilla pod split blanched almonds finely chopped cherries pitted caster sugar lemon juice arrowroot kirsch taste optional double cream whipped,18
762,oil onion chopped anchovy fillet chopped reduced veal stock chicken stock double cream cornflour salt freshly ground black pepper onion finely chopped double cream milk salt ground allspice fresh breadcrumbs beef mince pork mince vegetable oil frying plus extra greasing unsalted butter white cabbage shaved thinly mandoline head fennel shaved thinly mandoline salt apples shaved thinly mandoline olive oil soured cream salt pepper white wine vinegar new potatoes cooked,18
763,raw beetroot scrubbed skin left cherry vinegar red onion finely chopped bramley apple peeled finely grated wholegrain mustard olive oil horseradish freshly grated honey handful foraged leaves sea aster sea beet chickweed chopped rapeseed oil taste bestquality rump steak trimmed finely diced sea salt flakes freshly ground black pepper smoked soft cheese single cream cr fra che unsalted butter brown breadcrumbs foraged leaves,18
764,butter softened caster sugar lemon zest plain flour ground almonds ground cardamom heaped cardamom seeds ground pestle mortar,18
765,unsalted butter milk salt plain wholemeal plain flour plus extra dusting strong white flour fastaction yeast ground cardamom optional caster sugar freerange eggs olive oil greasing unsalted butter softened caster sugar cinnamon freerange egg beaten,18
766,cod fillet skinned boned whipping cream lemon zest freerange egg beaten plain flour plus extra dusting salt turns black peppermill handful dill chopped capers chopped butter freerange egg yolk white wine vinegar salt olive oil mayonnaise see finely chopped capers finely chopped pickled gherkin onion finely grated squeeze lemon juice dijon mustard curry powder handful chives chopped sprigs fresh tarragon chopped whipping cream lightly whipped,18
767,leeks sliced carrots sliced onion chopped butter plus extra greasing cod loin skinned cut chunks plain flour dry white wine salt freshly ground black pepper white wine vinegar shallots finely chopped sprigs fresh tarragon plus freshly chopped bay leaf peppercorns freerange egg yolks unsalted butter,18
768,klippfisk salt cod soaked hours pints boiling water sprig rosemary mustard seeds allspice white peppercorns cloves garlic clove finely chopped leek finely shredded onion sliced carrots shredded sliced butter pints milk pints soured cream rosemary sprigs garnish,18
769,olive oil onion sliced carrot diced celery stick diced crayfish around crayfish shelled tail meat reserved soup white wine bay leaves bunch dill stems sprigs parsley garlic cloves peeled left whole lemon zest black peppercorns star anise butter onion finely chopped potatoes cut cubes leeks washed sliced rounds dill leaves salt freshly ground black pepper cr fra che,18
770,crayfish bottle stout salt sugar bunch dill crowns dill leaves anise seeds fennel seeds butter truffle oil salt,18
771,plain flour baking powder caster sugar pinch salt freerange eggs milk butter melted icing sugar dusting fruit comp te cr fra che sour cream,18
772,split peas pinch bicarbonate soda ham hock onions one left whole cloves stuck one finely chopped blade mace bay leaves carrot finely chopped hot mustard double cream optional salt freshly ground black pepper,18
773,strong white flour plus extra dusting salt approximately teaspoon fastaction yeast unsalted butter softened cut cubes plus extra greasing caster sugar freerange eggs fullfat milk warmed dried cherries mixed peel sultanas dried apricots chopped pecans chopped caster sugar ground cinnamon apricot jam lemon juice icing sugar,18
774,yellow mustard seeds brown mustard seeds white wine vinegar honey light ale freerange egg yolks white wine vinegar dijon mustard vegetable oil chopped fresh dill caster sugar fine salt fresh dill chopped side salmon filleted skin removed pin boned heads little gem lettuce leaves separated freerange egg yolk english mustard clear honey cider vinegar vegetable sunflower oil banana shallot finely chopped garlic clove finely chopped finely chopped flatleaf parsley finely chopped mint finely chopped basil finely chopped thyme wholemeal bread butter,18
775,water limes juice white wine white peppercorns bay leaves white wine vinegar salt x herring fillets cooked new potatoes mayonnaise chopped fresh dill wholegrain mustard lemon juice curry paste salt freshly ground black pepper sprigs fresh dill lemon wedges,18
776,cooked beetroot quartered good handfuls fresh dill roughly chopped sea salt freshly ground black pepper caster sugar runny honey wholegrain mustard x salmon fillets swedish crisp bread serve watercress sprigs serve fresh dill sprigs serve caster sugar cider vinegar sea salt shallot thinly sliced cucumber thinly sliced cr fra che good handful fresh dill finely chopped lemon juice freshly ground black pepper,18
777,butter onion thinly sliced red cabbage around thinly shredded bramley apple peeled cored chopped red wine vinegar blueberries dark brown sugar bramble jelly jam redcurrant jelly cloves length cinnamon stick freshly ground black pepper salt bestend lamb chops plain flour freerange eggs beaten fresh white breadcrumbs butter frying vegetable rapeseed oil salt pepper new potatoes boiled knob butter freshly chopped parsley,18
778,mediumsized potatoes butter onion finely sliced tinned sprat fillets salt pepper single cream whole milk dried breadcrumbs,18
779,vegetable oil lard pork preferably pork shoulder diced stewing beef diced lamb mutton preferably shoulder neck fillet diced onions sliced carrots cut chunks optional black peppercorns allspice berries optional bay leaves optional salt freshly ground pepper mashed potato lingonberry jam,18
780,potatoes mediumsized potatoes plain flour freerange egg egg yolks sea salt knob butter button mushrooms finely chopped shallots finely chopped garlic clove finely chopped sprig thyme leaves finely chopped pinch allspice salt freshly ground black pepper butter plus extra frying frozen lingonberries defrosted sugar wild mushrooms,18
781,butter milk x sachet fastacting yeast caster sugar plain flour ground cardamom oil greasing raspberries granulated sugar milk double cream freerange egg yolks caster sugar vanilla extract cornflour freerange egg lightly beaten glazing icing sugar desiccated coconut,18
782,unsalted butter caraway seeds plain flour fullfat milk cream cheese salt freshly ground black pepper onion peeled finely chopped tinned tuna drained flaked pasta macaroni penne fusilli cooked according packet instructions drained dried breadcrumbs anchovy fillets cut half lengthways,18
783,sea salt sardines filleted cider vinegar cider caster sugar juniper berries pink peppercorns bay leaf sprigs fresh thyme onion thinly sliced vegetable oil deepfrying plain flour bottle beer anchovies lovage leaves salt freshly ground black pepper bunch fresh dill finely chopped mayonnaise wholegrain mustard american mustard lemon juice pinch sugar salt freshly ground black pepper pink fir apple potatoes pinch dill seeds olive oil white cabbage shredded cucumber thinly sliced toasted cumin seeds salt freshly ground black pepper,18
784,milk vanilla pod split half lengthways seeded scraped freerange egg yolks caster sugar cornflour unsalted butter raspberries jam sugar freerange eggs caster sugar cornflour plain flour baking powder butter melted pink readytoroll icing icing sugar dusting pints double cream dark chocolate cocoa solids melted ground almonds caster sugar icing sugar plus extra dusting freerange eggs beaten almond extract green food colouring paste use liquid food colouring,18
785,potatoes cut dice carrot cut cubes vegetable oil smoked bacon lardons leftover roast meat pork beef lamb diced butter onions diced mushrooms diced sprig thyme leaves smoked sausages diced dried mushrooms soaked boiled water freerange egg yolks tablespoons chopped marjarom oregano lingonberry jam slices pickled beetroot,18
786,fullfat milk water dark soft brown sugar x sachet fastaction dried yeast rye flour strong white flour plus extra dusting fine sea salt caraway seeds sunflower oil greasing,18
787,wholemeal rye flour plus extra dusting salt baking powder heaped anise seeds fennel seeds honey butter softened freerange egg white mixture seeds caraway anise poppy sesame,18
788,caster sugar salt pink peppercorns coriander seeds bunches fresh dill leaves chopped salmon fillet skin pin bones removed dijon mustard juniper berries brown mustard seeds yellow mustard seeds pinch dark soft brown sugar red wine vinegar sea salt freshly ground black pepper champagne pumpernickel bread serve optional,18
789,x centrecut pieces salmon skin pinbones removed coarse sea salt light muscovado sugar granulated sugar dill seeds coriander seeds cracked black pepper limes zest gin fresh dill roughly chopped lemon cut wedges rye bread lightly dressed green salad,18
790,caster sugar water whipping cream granny smith apples peeled cored chopped cubes sea salt fullfat milk butter strong white flour salt x sachet fastaction dried yeast vegetable oil greasing,18
791,lukewarm water sugar sachet fastaction dried yeast plain flour plus extra dusting milk salt butter melted freerange egg oil greasing tray egg beaten glazing sealing olive oil onion finely chopped garlic cloves crushed boiled smoked ham chopped jarlsberg cheese grated finely chopped parsley caraway seeds flaked sea salt freshly ground black pepper,18
792,savoy cabbage vegetable oil salt white wine vinegar caster sugar red onions cut wedges light chicken stock butter banana shallot finely chopped garlic cloves finely chopped pearl barley dry white wine cream cheese v sterbotten parmesan cheese grated fennel seeds dill seeds coriander seeds sushigrade salmon fillet beetroot peeled fennel bulb piece fresh horseradish grated buttermilk optional,18
793,milk honey butter fresh yeast instant yeast flour salt vegetable oil chanterelles sugar white wine vinegar cinnamon stick black peppercorns shallot roughly sliced frozen lingonberries caster sugar unsalted butter room temperature allspice peppercorns ground sherry vinegar pinch salt sirloin steak preferably grassfed beef cut cubes cold pressed rapeseed oil olive oil chopped shallot dijon mustard salt chopped curly parsley freshly grated horseradish,18
794,plain white flour plus extra dusting wholegrain spelt flour sea salt butter chopped plus extra greasing quark fromage frais baby spinach leaves shallot finely chopped knob butter freerange eggs cr fra che cottage cheese ground nutmeg sea salt plus extra taste freshly ground black pepper plus extra taste smoked salmon slices cut squares kale trimmed washed shredded excess water squeezed pomegranates seeds removed lime juice rapeseed oil,18
795,freerange egg yolks dijon mustard lemon juice flavourless oil sea salt freshly ground black pepper white wine vinegar cucumbers thinly sliced caster sugar pinch sea salt carrot peeled finely chopped shallot grated celery finely chopped cucumber deseeded finely chopped homemade mayonnaise curry powder ground turmeric mustard powder lemon juice pinch caster sugar salt freshly ground pepper cod fillet another white fish finely chopped onion grated freerange eggs lightly beaten grated nutmeg finely chopped fresh dill finely chopped tarragon leaves capers finely chopped plain flour salt freshly ground black pepper sparkling water salted butter slices rye bread salted butter sprigs fresh dill,18
796,plain flour cinnamon ground ginger freshly grated nutmeg baking powder salt soft brown muscovado sugar whole milk butter candied peel finely chopped flaked almonds garnish optional,18
797,milk saffron threads unsalted butter strong white bread flour plus extra dusting salt x sachet instant yeast caster sugar quark cheese vegetable oil greasing optional freerange egg yolk glazing raisins,18
798,bottle red wine quality matter sticks cinnamon dried root ginger dried seville orange peel orange cant get seville green cardamom pods whole cloves sugar flaked almonds raisins splash either vodka aquavit rum cognac optional,18
799,saffron threads tepid milk strong white flour sachet fastaction dried yeast salt golden caster sugar unsalted butter melted quark cheese freerange egg yolk handful raisins,18
800,olive oil onion finely chopped garlic clove finely chopped wild boar pork minced anchovy fillets finely chopped breadcrumbs freerange egg milk single cream allspice nutmeg salt freshly ground pepper butter flour white wine beef stock single cream lingonberry jam redcurrant jelly sprigs dill finely chopped,18
801,maris piper potatoes peeled cut chunks freerange egg beaten butter red onion finely chopped beef mince pork mince ground allspice bunch flatleaf parsley finely chopped single cream salt freshly ground black pepper unsalted butter red onion finely chopped carrot peeled finely chopped beef stock plain flour pinch ground allspice single cream soy sauce redcurrant jelly maris piper potatoes peeled cut chunks butter whole milk freshly chopped dill plus sprigs serve,18
802,olive oil spanish onion finely chopped dried oregano celery salt pinch cumin pork mince freerange egg yolk plain flour plus extra dusting mustard salt freshly ground black pepper olive oil clove fresh garlic crushed paste pestle mortar passata pressed seived tomatoes salt freshly ground black pepper hard cheese gruy emmental cheddar grated,18
803,trout fillets sea trout arctic char pinboned whole milk ground almonds flour seasoned salt pepper olive oil butter flaked almonds finely chopped parsley chopped capers lemon juice zest,18
804,strong white flour plus extra dusting cornflour sachet fastaction yeast caster sugar ground cardamom salt soya milk almond milk dairyfree margarine dairyfree margarine golden syrup soft light brown sugar pinch salt soft light brown sugar ground cinnamon pecans toasted chopped spiced apple butter apple pur e pur ed medjool dates,18
805,distilled vinegar caster sugar pinch flaked sea salt mustard seeds dill lebanese cucumbers finely sliced using mandolin fennel bulb finely sliced using mandolin shallots finely chopped white wine vinegar salt arctic char fillet extra virgin olive oil drizzling scottish girolles washed cold water dried kitchen paper chives finely chopped cooked prawns peeled dill garnish flaked sea salt,18
806,olive oil x leg lamb cut bone pieces onion sliced garlic clove salt black pepper ground ginger ground turmeric saffron strands bunch fresh coriander bunch fresh parsley cinnamon sticks dried apricots dried prunes caster sugar ground cinnamon vegetable oil blanched almonds toasted sesame seeds,19
807,pistachio kernels caster sugar ground cinnamon sheets readymade filo pastry cornflour dusting unsalted butter melted clear honey caster sugar lime zest cinnamon stick limes zest removed long thin strips using canelle knife pistachio kernels halved,19
808,braising steak ideally chuck steak sunflower oil onions halved sliced garlic cloves finely chopped ground cumin ground coriander hot chilli powder chopped tomatoes chickpeas drained rinsed clear honey beef stock cube cinnamon stick sweet potato around eating apples bunch fresh coriander nosoak dried prunes halved flaked sea salt freshly ground black pepper redskinned eating apple butter clear honey,19
809,dried red chillies soaked cold water drained roughly chopped fresh red chillies seeds removed roughly chopped ground cumin ground caraway seeds smoked sweet paprika garlic cloves tomato pur e red wine vinegar olive oil rump steak cut cubes olive oil salt freshly ground black pepper red onions cut wedges lemon juice butter olive oil onion finely chopped garlic clove finely chopped basmati rice lemon zest juice chicken stock salt freshly ground black pepper coriander leaves roughly chopped,19
810,olive oil onion peeled finely chopped garlic cloves peeled finely chopped cayenne pepper ground ginger ground coriander ground cumin cinnamon stick ground turmeric butternut squash peeled seeds removed cut cubes tinned chopped tomatoes vegetable stock preserved lemons rind roughly chopped clear honey salt freshly ground black pepper couscous pint hot vegetable stock lemons zest toasted flaked almonds chopped fresh parsley chives coriander olive oil handful coriander garnish,19
811,butter chicken cut pieces onions finely chopped garlic cloves finely chopped piece root ginger grated cinnamon sticks raselhanout north african spice blend salt freshly ground black pepper ground turmeric ground cinnamon saffron preserved lemon roughly chopped honey pint chicken stock dates stones removed halved salt freshly ground black pepper chopped fresh flatleaf parsley bulgur wheat soaked cold water overnight red onion finely chopped tomatoes seeds removed finely diced bunches flatleaf parsley roughly chopped bunch mint roughly chopped bunch coriander roughly chopped lemon juice extra virgin olive oil,19
812,olive oil chicken thighs around boneless butter onions finely chopped garlic cloves finely chopped ground ginger ground cinnamon ground turmeric pinch saffron chicken stock water freerange eggs beaten ground almonds pistachios dried dates finely chopped orange blossom water finely grated orange zest finely chopped fresh parsley butter melted sheets filo pastry egg beaten glaze salt freshly ground black pepper icing sugar garnish pinch ground cinnamon garnish,19
813,onions finely chopped garlic cloves finely chopped sprigs fresh coriander finely chopped bunch fresh flatleaf parsley finely chopped olive oil lemon juice salt freshly ground black pepper ground ginger cinnamon ground turmeric chicken legs skinned rinsed cold running water patted dry pinch saffron chicken stock cube dried prunes sugar dried apricots almonds blanched skinned toasted,19
814,green olives olive oil onion chopped chicken breasts garlic cloves chopped raselhanout available supermarkets specialist shops saffron threads ground ginger freshly ground black pepper preserved lemon peel chopped chopped fresh coriander chopped fresh parsley vegetables serve,19
815,olive oil frying chicken thighs onion finely chopped garlic cloves finely chopped piece fresh root ginger grated saffron ground turmeric ground coriander raselhanout cinnamon stick chicken stock red chilli finely sliced tomatoes roughly chopped clear honey roughly chopped mint leaves roughly chopped coriander butter salt pepper bulgur wheat soaked cold water overnight roughly chopped mint roughly chopped coriander red onion finely chopped pistachio nuts roughly chopped whole skinned almonds dried apricots roughly chopped pomegranate seeds lemons juice,19
816,olive oil onions roughly chopped garlic cloves finely chopped ground ginger ground white pepper ground cinnamon cloves roughly broken generous pinch saffron soaked little water chicken stock water whole chicken jointed pieces preserved lemons cut strips green olives fresh parsley finely chopped fresh coriander finely chopped,19
817,thumbnailsized piece tamarind pod pint goodquality red wine best beef mince best results get good rump steak mince blanched almonds black peppercorns crushed thumbsized piece fresh ginger finely chopped hot chillies finely chopped sprigs marjoram leaves coriander seeds crushed cloves garlic finely chopped onion finely chopped one lemon grated zest handful sultanas pint double cream unsalted butter softened salt freshly ground black pepper bay leaves cumin seeds sprinkling butter greasing pint milk eggs whisked curry powder teaspoon baking powder freshly grated nutmeg taste salt freshly ground black pepper,19
818,couscous salt pine nuts pint boiling water,19
819,quinoa cooked according packet instructions handful fresh parsley chopped chopped fresh mint red pepper finely diced cucumber finely diced red onion finely diced extra virgin olive oil lemon juice salt freshly ground black pepper cloves fennel seeds coriander seeds cumin seeds paprika pinch turmeric chilli flakes hazelnuts chopped pistachios chopped sesame seeds honey orange juice salt freshly ground black pepper olive oil lamb cutlets,19
820,chicken breast cut cubes chicken thighs wings harissa paste vegetable oil onion sliced garlic cloves crushed ground cinnamon ground cumin ground ginger ground turmeric chilli flakes chicken stock dried apricots quartered x tin chopped tomatoes x tin chickpeas rinsed drained salt freshly ground black pepper freshly chopped mint freshly chopped parsley couscous cooked according packet instructions greekstyle yoghurt handful flaked almonds,19
821,sesame seeds blanched almonds coriander seeds cumin seeds sea salt pepper turkish bread olive oil,19
822,ground cumin ground turmeric raselhanout spice mix saffron strands vegetable oil goat meat mixture shoulder neck leg cut dice onion finely chopped garlic cloves chopped red chilli stalk seeds removed chopped fresh root ginger unpeeled finely grated cinnamon stick x tin tinned tomatoes honey readytoeat dried apricots roughly chopped preserved lemon skin roughly chopped sea salt freshly ground black pepper pistachios roughly chopped roughly chopped fresh coriander leaves roughly chopped fresh flat leaf parsley roughly chopped fresh mint leaves butter couscous pistachios roughly chopped flaked toasted almonds pine nuts toasted readytoeat apricots roughly chopped preserved lemon skin finely chopped roughly chopped fresh mint leaves roughly chopped fresh coriander root leaves roughly chopped fresh flatleaf parsley lemon juice sea salt freshly ground black pepper,19
823,bulgur wheat pints chicken stock warmed chipotle dried chillies fenugreek seeds cumin seeds coriander seeds garlic cloves roughly chopped shallots roughly chopped red chillies seeds removed roughly chopped olive oil rapeseed oil toasted pine nuts pomegranate seeds bunch fresh mint roughly chopped bunch fresh coriander roughly chopped lemon zest juice salt freshly ground black pepper lamb chops bunch rosemary tied string olive oil,19
824,vegetable oil lamb chops fat trimmed onion finely chopped pinch saffron ras el hanout ground ginger ground white pepper ground black pepper beef stock cube brown lentils pints boiling water tomato pur e tin chopped tomatoes chickpeas drained rinsed plain flour vermicelli noodles bunch fresh parsley finely chopped bunch fresh coriander finely chopped,19
825,olive oil ground cumin ground coriander lamb neck fillet trimmed cut pieces piece fresh root ginger finely grated onions thinly sliced dry white wine tin chopped tomatoes tomato pur e clear honey harissa paste preferably rose lemon juice finely grated rind tin cannellini beans drained rinsed salt freshly ground black pepper,19
