,Ingredients,Cuisine
438,plain flour aubergines sliced discs dried breadcrumbs see tip left make save money vegetable oil basmati rice onion finely chopped garlic cloves crushed curry powder clear honey coconut milk cucumber,9
439,x pots greek yoghurt caster sugar green tea matcha powder caster sugar toasted sesame seed,9
440,caster sugar sushi rice sesame seed toasted sesame oil sunflower oil longstemmed broccoli tenderstem purple sprouting pack baby pak choi halved lengthways spring onions halved lengthways brown miso paste mirin rice wine vinegar soft brown sugar finely grated ginger red chilli deseeded diced,9
441,shallots carrot cut chunks boneless skinless chicken breast thighs cut chunks zest juice lemon little oil basmati rice spring green chopped mirin soy sauce caster sugar,9
442,sweet potatoes cut wedges vegetable oil plus little extra sesame seed miso paste juice lemon hot chilli sauce sriracha nice mirin bavette lean steaks handful watercress leaves serve,9
443,nori sheets skinless salmon fillet use really fresh thinly sliced lengthways cucumber deseeded thinly sliced lengthways squeeze wasabi plus extra serve pickled sushi ginger serve light soy sauce serve salmon roe serve optional sushi rice sak mirin optional caster sugar omit using mirin rice vinegar,9
444,sushi rice skinless salmon fillet ripe avocados sliced juice lemon light soy sauce toasted sesame seeds spring onions thinly sliced red chilli deseeded thinly sliced handful coriander leaves,9
445,trimmed sirloin steak teriyaki sauce marinade used kikkoman teriyaki marinade cucumber coriander roughly chopped juice lime little gem lettuces leaves red chilli deseeded thinly sliced red onion thinly sliced,9
446,white miso paste lowsodium soy sauce rice wine vinegar x skinless pollock fillets bunch spring onions sliced diagonally cucumber peeled strips potato peeler beansprout radishes sliced red chilli chopped deseeded like limes juiced cut wedges sesame oil,9
447,chicken breasts milk plain flour eggs beaten panko breadcrumbs coarse dried breadcrumbs sprinkling shichimi togarashi chilli power plus extra serve splash soy sauce sunflower oil frying butter carrot chopped onion chopped garlic cloves chopped piece ginger chopped mild curry powder honey ketchup red brown miso paste soy sauce chicken stock cube shredded white cabbage shredded nori sesame seeds cooked rice serve,9
448,lowsodium soy sauce mirin lemon juice caster sugar soba noodle thinstemmed broccoli cooked prawn red chilli thinly sliced,9
449,soy sauce rice wine vinegar caster sugar tuna steaks potato semiskimmed milk wasabi paste see knowhow spring onion finely sliced frozen broad bean soya beans serve,9
450,red peppers aubergines cut chunks halved extravirgin olive oil cinnamon green bean blanched use frozen red onion sliced half moons feta cheese drained crumbled seeds pomegranate handful parsley roughly chopped garlic clove crushed lemon juice pomegranate molasses extravirgin olive oil,10
451,quinoa butter red chilli deseeded finely chopped garlic clove crushed chicken mini fillets extravirgin olive oil vine tomato roughly chopped handful pitted black kalamata olive red onion finely sliced feta cheese crumbled bunch mint leaves chopped juice zest lemon,10
452,olive oil onion thinly sliced garlic clove crushed oregano fresh dried x cherry tomatoes roasted red pepper jar sliced new potato halved black olive sliced handful basil leaves torn,10
453,red peppers courgette quartered lengthways thinly sliced x packs readytoeat quinoa feta cheese finely crumbled handful parsley roughly chopped,10
454,olive oil smoked lardons eggs lightly beaten bunch chives snipped brie sliced red wine vinegar dijon mustard cucumber halved deseeded sliced diagonal radishes quartered,10
455,peppers colour deseeded cut chunky pieces sweet potato peeled cut chunky pieces courgettes sliced chunks red onion cut wedges olive oil lean lamb cutlets thyme leaf chopped mint leaves chopped,10
456,olive oil onion thinly sliced baby cooking chorizo sliced garlic cloves crushed smoked paprika chopped tomato basmati rice stock lemon zest peeled thick strips plus wedges serve fresh bay leaves bunch parsley chopped,10
457,broad bean fresh frozen feta cheese vegetarian alternative drained chopped shredded mint leaves extravirgin olive oil bag mixed salad leaf cherry tomatoes halved lemon juice thin slices baguettes white brown,10
458,olive oil aubergines cut cubes long shallots chopped plum tomatoes chopped caper soaked salted raisin celery sticks sliced red wine vinegar handful toasted pine nuts basil leaves slices ciabatta olive oil drizzling garlic clove,10
459,fine green bean trimmed figs quartered shallot thinly sliced x ball mozzarella drained ripped chunks hazelnut toasted chopped handful basil leaves torn balsamic vinegar fig jam relish extravirgin olive oil,10
460,new potato green bean handful black kalamata olives zest juice lemon olive oil chunky pollock fillets another sustainable white fish slices pancetta thinly sliced smoked streaky bacon tarragon sprigs leaves picked,10
461,butternut squash peeled cut cubes raw beetroot cut cubes red onions cut slim wedges olive oil juice lemon fine polenta salt butter grated cheese used mix parmesan taleggio big handful rocket serve freshly picked thyme leaf grated parmesan,10
462,butter fresh breadcrumb zest lemon garlic cloves crushed red chilli finely chopped spinach,10
463,red peppers deseeded cut chunks red onion cut wedges olive oil skinon chicken breasts x pack fullfat garlic herb soft cheese pack cherry tomatoes handful black olives,10
464,ripe tomatoes olive oil garlic clove finely chopped shallot finely chopped red green chilli deseeded finely chopped glass dry white wine tomato paste pinch sugar cleaned mussels good handful basil leaves,10
465,red peppers halved deseeded anchovy oil drained smallish tomatoes halved garlic cloves thinly sliced rosemary sprigs olive oil,10
466,baby new potatoes thinly sliced courgette diagonally sliced red onion cut wedges yellow pepper seeded cut chunks firm plum tomatoes halved black olives pitted skinless boneless chicken breast fillets olive oil rounded green pesto,10
467,pack readyrolled puff pastry green pesto frozen sliced roasted peppers frozen artichokes wedges per serving ball mozzarella cheddar grated,10
468,red peppers x pouches cooked tomato rice used tilda rizazz mediterranean tomato pesto handful pitted black olives chopped goats cheese sliced,10
469,mussel shells toasted breadcrumb zest lemon garlic parsley butter see goes well recipe,10
470,pinch saffron strands garlic cloves crushed egg yolks dijon mustard olive oil,10
471,watermelon peeled deseeded cut chunks block feta cheese cubed handful black olives handful flatleaf parsley mint leaves roughly chopped red onion finely sliced rings olive oil balsamic vinegar serve pack white bread mix olive oil plus little extra drizzling plain flour dusting egg white beaten mix sesame seeds poppy seeds fennel seeds scattering,10
472,cleaned squid tubes tubes plain flour cayenne pepper chilli powder sunflower oil frying aubergine extravirgin olive oil onion chopped celery sticks sliced cherry tomatoes garlic cloves crushed caster sugar balsamic vinegar green olive stoned caper rinsed salted handful basil leaves shredded,10
473,figs halved butter clear honey brown sugar ground cinnamon orange juice star anise shortbread fingers serve ball stem ginger finely chopped ginger syrup jar tub mascarpone,10
474,selfraising flour baking powder salt butter cut pieces olive oil halves italian sundried tomatoes coarsely chopped feta cheese cubed black olives pitted halved full fat milk egg beaten glaze,10
475,juice lime plus wedges serve red chilli deseeded chopped garlic cloves crushed bunch coriander chopped raw peeled prawn avocado stoned skinned heaped soured cream plus extra serve olive oil red pepper deseeded sliced flour tortillas good handful mixed salad leaves serve,11
476,sirloin rump steaks big sunflower oil chipotle paste used discovery whole roasted red pepper jar quartered ripe avocado stoned chunkily diced lime cut wedges coriander sprigs leaves picked dollops soured cream onion chopped sunflower vegetable oil ground cumin hot paprika plus pinch extra optional tomato pur e chipotle paste brown sugar wine vinegar red white black bean drained rinsed pinto kidney bean drained rinsed,11
477,corn tortillas vegetable oil ripe avocados juice limes red onion finely diced handful coriander chopped green chillies deseeded finely chopped chipotle paste chipotle tabasco plum tomatoes halved green jalapeno chillies garlic cloves unpeeled red onion finely diced coriander roughly chopped juice lime chipotle paste chipotle tabasco,11
478,sunflower oil stewing beef white onions sliced chipotle paste garlic cloves crushed ginger grated ground cumin ground cinnamon plain flour beef stock x cans chopped tomatoes dried oregano x cans pinto kidney beans drained,11
479,vegetable oil onion finely chopped garlic cloves finely chopped dark brown sugar chipotle paste used discovery chopped tomatoes skinless boneless chicken breasts red onion sliced rings coriander leaves corn tortillas rice serve,11
480,onion chopped olive oil soft brown sugar wine vinegar cajun seasoning tin mixed beans rinsed drained tin chopped tomatoes garlic handful grated cheddar tortilla chips serve chopped avocado optional,11
481,pancakes see recipe link olive oil onion chopped cauliflower cut florets chickpeas drained rinsed jar arrabbiata tomato sauce used loyd grossman chopped fresh coriander tub lowfat natural yogurt baby spinach leaves,11
482,garlic cloves unpeeled onion cut thick slices ancho chilli red dried chilli deseeded trimmed soft brown sugar cider vinegar x skinless salmon fillets lime zested cut wedges cr fra che soured cream chopped coriander serve optional,11
483,potato cut cubes olive oil onion finely chopped garlic clove finely chopped mild chilli powder paprika cumin cayenne pepper soured cream serve,11
484,olive oil onion chopped garlic cloves crushed ancho dried chilli deseeded softened boiling water mins ground cumin plum tomato l chicken stock chicken breasts sliced juice limes tortilla chips homemade tortilla strips see chopped avocado lime wedges red onion coriander serve,11
485,onion red pepper garlic cloves oil heaped hot chilli powder level mild paprika ground cumin lean minced beef beef stock cube chopped tomatoes dried marjoram sugar add thumbnailsized piece dark chocolate along beans instead see tip tomato pur e red kidney beans plain boiled long grain rice serve soured cream serve,11
486,flour tortillas refried beans big pinch cayenne pepper kidney beans water rinsed handfuls cherry tomatoes quartered cheddar green chilli thinly sliced avocado halved stoned sliced handful coriander leaves serve,11
487,eggs avocados peeled stoned x cans beans used pinto bean kidney beans rinsed drained red onion finely sliced bunch coriander leaves roughly chopped punnet cherry tomato halved bottle bought goodquality dressing used english provender company lime coriander dressing red chilli deseeded finely sliced cumin,11
488,vegetable oil trimmed pork shoulder cut chunks tomato pur e hot chicken stock strips zest juice orange cinnamon stick thyme sprigs onions cut chunks garlic cloves pack cherry tomato vegetable oil x packs corn tortillas flaked almond raisin ground coriander cumin chipotle paste plain chocolate finely chopped radish trimmed thinly sliced avocados chopped juice limes bunch coriander leaves green chillies finely chopped,11
489,vegetable oil onion chopped heaped chipotle paste carton passata vegetable stock kidney beans drained rinsed black beans drained rinsed feta garlic cloves crushed flour tortillas pack coriander roughly chopped serve,11
490,rindless pork shoulder cut chunks red onion roughly chopped garlic cloves crushed habanero chilli sauce tomato pur e juice oranges around fl juice limes around fl white wine vinegar dried oregano ground allspice ground cumin ground nutmeg ground cloves red onions finely sliced white wine vinegar cider vinegar caster sugar corn tacos warmed little gem lettuces trimmed finely shredded soured cream halffat cr fra che,11
491,boneless white fish fillets haddock hoki pollock fajita seasoning texmex seasoning sunflower oil pot guacamole handful coriander leaves roughly chopped lime wedges serve,11
492,plain corn tortilla chips cooked chicken breasts shredded pieces spring onions thinly sliced red leicester cheese grated jar red green sliced pickled jalape peppers bunch coriander leaves roughly chopped choice salsa hot pepper sauce like chipolte tabasco cr fra che guacamole extra jalape os serve,11
493,selfraising flour egg beaten canned frozen sweetcorn bunch spring onions trimmed finely chopped avocado cut chunks lime juiced rest cut handful coriander leaves chopped vegetable oil refried beans serve,11
494,olive oil chicken breasts skin corn tortillas ripe tomatoes cut chunks red onion finely chopped long red chilli deseeded finely diced tabasco sauce juice limes plus extra limes cut wedges serve ripe avocados pack coriander leaves picked chopped pack basil leaves picked chopped handful flatleaf parsley leaves picked chopped,11
495,boneless skinless chicken breasts lime garlic cloves ground coriander chilli powder optional red pepper fresh coriander sunflower oil romaine lettuce heart ripe avocados flour tortillas caesar dressing,11
496,pudding rice zest lemon zest orange whole milk caster sugar raisins sultanas cinnamon stick light brown muscovado sugar double cream,11
497,red onions one thickly one thinly sliced juice limes dried oregano fat garlic cloves unpeeled plum tomatoes halved chipotle paste used discovery available waitrose chilli powder soft brown sugar pork tenderloins coriander sprigs warm soft tortillas flour corn serve,11
498,watercress bunch chives lemon zested garlic soft cheese roasted chicken breasts skin removed reserved flour tortillas mature cheddar grated mozzarella grated,11
499,olive oil onion diced garlic cloves crushed red kidney beans drained rinsed ground cumin chilli powder dried oregano eggs flour tortillas warmed tomato diced handful pickled jalapen peppers roughly chopped cheddar grated avocado peeled destoned diced lime half juiced half cut wedges serve chopped coriander serve,11
500,dried morita chillies dried ancho chilli dried pasilla mixe chilli garlic cloves sea salt balsamic vinegar avocado leaves grapeseed oil plus frying lamb shanks banana leaves vegetable beef stock bulb garlic cloves peeled red onions sliced tomatoes thickly sliced tomatillos roughly chopped green jalape os garlic cloves peeled bunch coriander lime juiced avocado peeled stone removed corn tortillas mexican crema soured cream queso fresco feta cos lettuce shredded toothpicks,11
501,rapeseed oil red onion sliced red peppers deseeded sliced garlic cloves crushed chipotle paste add extra prefer heat skinless chicken breasts cut thin strips black beans kidney beans bunch coriander chopped passata ketchup sugar tortillas mature cheddar grated green salad serve,11
502,wholemeal penne rapeseed oil onion sliced plus finely chopped orange pepper deseeded cut chunks garlic cloves grated mild chilli powder ground coriander cumin seeds chopped tomatoes sweetcorn water vegetable bouillon powder avocado stoned chopped lime zest juice handful coriander chopped plus extra serve,11
503,olive oil onion finely chopped peppers choose favourite colours finely chopped garlic cloves finely chopped crushed cumin seeds ground cumin tomato pur e pinch sweet smoked paprika basmati rice hot vegetable stock make sure veganfriendly finely chopped coriander sliced spring onions serve,11
504,chicken breasts finely sliced red onion finely sliced red pepper sliced red chilli finely sliced optional heaped smoked paprika ground coriander pinch ground cumin garlic cloves crushed olive oil lime juiced drops tabasco tortillas bag mixed salad tub fresh salsa,11
505,sunflower oil onion finely chopped garlic cloves minced long grain rice chipotle paste optional want spicier tomato pur e x tin chopped tomatoes hot chicken vegetable stock bunch coriander finely chopped,11
506,flavourless oil tin eggs separated caster sugar vanilla extract plain flour baking powder milk evaporated milk sweetened condensed milk double cream icing sugar pinch cinnamon,11
507,corn tortillas look near wraps mexican food olive oil onion chopped garlic cloves chopped smoked paprika ground cumin cider vinegar clear honey x cans black beans rinsed drained choose toppings chopped tomatoes sliced red onion diced avocado sliced jalape peppers coriander sprigs cr fra che tabasco chipotle sauce serve,11
508,ripe tomato avocados ripe bruised juice lime handful coriander leaves stalks chopped plus leaves roughly chopped serve red onion finely chopped chilli red green deseeded finely chopped tortilla chips serve,11
509,mixed peppers halved oil drizzling x pouches lime coriander rice cooked black beans drained rinsed mexicanstyle chilli cheese slices use regular cheddar monterey jack like fresh guacamole,11
510,olive oil red onion sliced red pepper sliced chorizo finely chopped garlic clove crushed chipotle paste cumin ground coriander raw king prawns peeled chopped lime juiced flour tortillas guacamole serve optional,11
511,beef stock ground cumin ground coriander garlic cloves finely chopped passata chipotle chilli paste tomato pur e want spicy piece braising beef x cans black beans kidney beans drained rinsed lime juiced bunch coriander chopped flour tortillas soured cream plain yogurt lime wedges diced avocado guacamole finely sliced red onion sliced red chilli sliced radishes chopped tomato crumbled feta grated mild cheddar,11
512,vegetable oil rapeseed oil peppers colour like sliced red onion halved sliced mixed beans drained fajita spice mix depending spicy like chopped tomatoes bunch coriander chopped corn tortillas lowfat soured cream grated cheddar,11
513,soft corn tortillas rapeseed oil sweet smoked paprika plus extra serve red peppers halved deseeded black beans drained rinsed bunch parsley finely chopped fatfree yogurt jalape finely sliced spring onions finely sliced tomatoes deseeded finely chopped avocado peeled stoned chopped bunch coriander finely chopped garlic clove finely grated lime zested juiced rapeseed oil,11
514,red cabbage finely shredded red onion thinly sliced carrots coarsely grated chopped pickled jalape chillies plus pickling liquid lime juiced optional,11
515,red onion finely chopped tomatoes chopped fresh coriander lime zest juice rapeseed oil red onion halved sliced garlic clove finely grated ground coriander mild chilli powder ground cinnamon blackeyed beans water cocoa vegetable bouillon tomato pur e,11
516,ripe avocado stoned cut pieces tomatoes deseeded diced chopped coriander lime juiced eggs lightly beaten olive oil frying thick slices sourdough crusty bread strong cheddar grated red chilli finely chopped,11
517,vegetable oil red onion chopped smoked paprika ground cumin pack lean pork mince passata barbecue sauce black bean drained bunch coriander chopped taco shells ripe avocado peeled sliced iceberg lettuce finely shredded soured cream serve optional,11
518,pack baby corn red onion sliced red pepper deseeded roughly chopped cumin seeds olive oil ripe kiwi halved lengthways tomato halved wholemeal flour plus extra rolling garlic clove fresh coriander chopped vegan bouillon powder smoked paprika red cabbage finely shredded,11
519,spring onions chopped sweetcorn drained tomatoes chopped finely pack coriander chopped limes zest juice green chilli chopped,11
520,frozen french fries olive oil finely chopped onion ripe avocado lime juiced plus wedges serve finely chopped red onion finely chopped tomato crushed garlic clove chipotle paste ground cumin ground coriander mixed beans drained chopped tomatoes chopped bunch coriander dairyfree cr fra che crispy fried onions,11
521,corn tortillas serve red onions cut wedges whole tomatoes garlic cloves ancho chillies smoky mexican spice mix plus watermelon see vegetable oil plus lemons avocado cream boneless beef brisket blade cut chunks ask butcher chicken stock bay leaves avocados soured cream pack coriander stems chopped leaves kept whole white wine vinegar sugar watermelon cut cubes seeds removed cumin seeds ground oregano smoked paprika ground cloves smoked salt flakes chipotle chilli flakes,11
522,chipotle paste egg rapeseed oil kale cherry tomatoes halved avocado sliced wholemeal tortilla wrap warmed,11
523,sunflower oil onion finely chopped garlic cloves finely chopped cumin seeds pinto kidney beans rinsed drained smoked paprika flour tortillas cheddar gruy coarsely grated handful coriander leaves tub fresh tomato salsa plus extra serve soured cream serve,11
524,yogurt mayonnaise jalapeno chilli garlic clove lime juiced pack coriander fajita seasoning lime juiced olive oil fajita seasoning cod loins around cut chunks corn tortilla griddled serve spoonfuls curtido tomatillo salsa serve refer method recipes,11
525,white cabbage around finely shredded red onion finely sliced carrots thinly sliced lengthways apple cider vinegar golden caster sugar pack coriander leaves roughly chopped,11
526,olive oil onions chopped carrots grated chilli powder mild hot according taste x cans chopped tomatoes x cans pulses water drained used mixed beans lentils wholemeal tortillas lowfat natural yogurt extramature cheddar cheese veg alternative finely grated,11
527,basmati rice olive oil garlic cloves chopped black beans drained rinsed cider vinegar honey chipotle paste chopped curly kale avocado halved sliced tomato chopped red onion chopped chipotle hot sauce coriander leaves lime wedges,11
528,boneless pork belly skin scored chipotle paste tomato pur e soft brown sugar pineapple cut chunks tortillas warmed serve x pouches mexican rice serve curtido tomatillo salsa serve refer method recipes,11
529,x cans kidney beans rinsed drained breadcrumb mild chilli powder bunch coriander stalks leaves chopped egg tub fresh salsa lowfat natural yogurt juice lime wholemeal burger buns sliced avocado sliced red onion salad leaves serve,11
530,olive oil onion sliced red peppers deseeded chopped largish chunks chipotle paste x cans chopped tomatoes skinless chicken breasts quinoa chicken stock cubes x pinto beans drained bunch coriander chopped leaves left whole juice lime sugar natural yogurt serve,11
531,brazil nuts roughly chopped handful kale woody stalks removed leaves shredded lime juiced wholemeal tortilla wraps pack coriander spiced tomato rice refried beans yellow pepper sliced avocado sliced optional hot sauce serve cream cheese milk,11
532,egg little rapeseed oil frying tomato salsa fresh coriander,11
533,olive oil garlic cloves finely chopped onions chopped sweet pimenton spanish paprika mild chilli powder ground cumin cider vinegar brown sugar x x cans chopped tomatoes x x cans black beans rinsed drained one following serve crumbled feta cheese chopped spring onions sliced radishes avocado chunks soured cream,11
534,tomatillos pack coriander white onion chopped green chillies roughly chopped garlic clove roughly chopped lime juiced avocado cut cubes,11
535,salt chilli powder black pepper ice juice lime shakes hot sauce mexican lager,11
536,olive oil chorizo pepperoni skin removed cut chunks paprika cherry tomatoes cut half skinless chicken breasts cut lengthways buy chicken fillets bag corn chips spicy like bit heat tub cr fra che jar jalape peppers extra cr fra che soured cream smashed avocado,11
537,garlic salt smoked paprika good pinch sugar salmon fillet fatfree yogurt chipotle paste hot chilli sauce juice lime soft flour tortillas warmed green cabbage finely shredded bunch coriander picked sprigs pickled jalapeno chillies sliced lime wedges serve hot chilli sauce serve optional,11
538,dried ancho guajillo chillies olive oil onion chopped garlic cloves chopped chipotle paste smoked hot paprika piment n ground cumin chicken stock chopped tomato peeled raw prawn halibut firm white fish fillets cut pieces clam new potato halved boiled juice limes lime wedges avocado chopped handful coriander leaves red onion finely diced corn tortillas sliced baked,11
539,vegetable oil garlic cloves chopped x cans black beans drained rinsed cider vinegar honey smoked paprika ground cumin garlic clove roughly chopped coriander green chilli sliced avocados halved stoned juice lime pack pomegranate seeds green chilli finely diced white onion finely diced handful fresh coriander chopped corn flour tortillas chipotle hot sauce soured cream coconut yogurt,11
540,flour tortillas cut croutonsized pieces olive oil cajun mexican seasoning mix iceberg lettuce shredded black bean rinsed drained pack cherry tomato halved avocados stoned peeled sliced juice lime bunch coriander leaves,11
541,chicken breast chipotle paste lime juiced slices cheese brioche bun split avocado cherry tomatoes chopped pickled jalape slices chopped garlic clove finely grated,11
542,red onion sliced thin rings juice limes plus wedges serve pinch caster sugar white crabmeat brine drained spring onions finely sliced red chilli deseeded chopped really ripe avocado peeled stoned chopped garlic clove crushed corn tortillas handful mixed salad leaves,11
543,vegetable oil sunflower oil corn tortilla wrap egg black beans drained juice lime ripe avocado peeled sliced feta crumbled hot chilli sauce like sriracha,11
544,olive oil onion finely chopped beef mince fresh white breadcrumb ground cumin coriander chipotle paste basmati rice chopped tomato kidney bean drained rinsed handful coriander serve,11
