,Ingredients,Cuisine
0,chicken thighs drumsticks sea salt flakes soft dark brown sugar chilli flakes sweet smoked paprika ground cumin sea salt flakes dark brown sugar butter hot chilli sauce maple syrup,1
1,chicken beef short ribs ribs separated piece boned pork shoulder rind removed texas barbecue sauce sliced sweet white onions sliced gherkins serve goodquality flaky sea salt fennel seeds black peppercorns bay leaves cayenne pepper smoked paprika garlic salt soft light brown sugar golden caster sugar wood chips optional,1
2,unsalted butter softened golden caster sugar egg yolks lightly beaten plain flour plus extra dusting pecans toasted eggs golden caster sugar golden syrup unsalted butter melted sea salt plus extra sprinkling vanilla extract bourbon whisky optional double cream maple syrup,1
3,whole chicken jointed bonein chicken pieces used legs breasts thighs wings sea salt smoked paprika garlic granules runny honey cider vinegar light brown soft sugar american mustard,1
4,macaroni whole milk bay leaves butter plain flour dijon mustard roughly chopped thyme leaves porcini white truffle paste truffle oil porcini powder dried porcini mushrooms blitzed powder food processor taleggio cheese chopped ball mozzarella chopped mature cheddar grated fresh breadcrumbs parmesan finely grated,1
5,milk chocolate fullfat milk mini marshmallows digestive biscuits strawberries washed hulled pineapple chunks skewers,1
6,vegetable oil onion chopped garlic cloves crushed smoked paprika cayenne pepper green pepper finely chopped x chopped tomatoes chicken vegetable stock bay leaf spring onions trimmed sliced,1
7,skinless chicken breasts olive oil rashers smoked bacon avocados ciabatta rolls split thin slices favourite cheese handfuls baby spinach leaves mayonnaise serve optional ground cumin ground coriander paprika,1
8,coarse bread sourdough crusts removed fullfat milk olive oil corn cobs ripe avocados lime juiced spring onions trimmed sliced diagonal use purple ones add colour find tomatoes mixture colours sizes good sliced horizontally halved mayonnaise level dijon mustard garlic clove grated chives finely chopped buttermilk,1
9,distilled malt vinegar golden caster sugar onions cut rings oil deepfrying plain flour cayenne pepper ground coriander smoked paprika serve cornflour plain flour bicarbonate soda lager,1
10,whole chicken wings olive oil celery sticks cut sticks keep leaves bunch french breakfast radishes leaves get tomato ketchup cider vinegar bourbon dark brown sugar hot chilli sauce worcestershire sauce ground cumin ground coriander ground paprika butter gorgonzola soured cream mayonnaise good squeeze lemon juice,1
11,sunflower oil deepfrying bunch coriander leaves picked serve lemon zested optional cut wedges serve buttermilk garlic granules ground ginger jumbo raw prawns head left tails peeled butterflied plain flour cornflour cayenne pepper dried thyme ground coriander cornflakes crushed fine crumbs,1
12,sweet potatoes peeled cut chunks milk mature cheddar finely grated rapeseed oil onions halved sliced lean beef mince fat smoked paprika plus extra sprinkling ground cumin ground coriander mild chilli powder vegetable bouillon powder blackeyed beans chopped tomatoes green pepper diced sweetcorn water broccoli salad serve optional,1
13,ribeye steak approx olive oil garlic cloves crushed whole green peppers sliced hot dog buns smoked cheddar sliced yellow mustard used french serve crispy onions,1
14,butter onion finely chopped corn cobs sugar single cream grated cheddar mozzarella,1
15,selfraising flour baking powder golden caster sugar eggs melted butter plus extra cooking milk vegetable oil cooking maple syrup toppings choice cooked bacon chocolate chips blueberries peanut butter jam,1
16,light brown soft sugar smoked paprika english mustard powder celery salt garlic granules racks baby back pork ribs yellow mustard used french classic cider vinegar treacle light brown soft sugar worcestershire sauce hot chilli sauce hot chilli powder,1
17,plain flour salted butter cubed cream cheese icing sugar salted butter maple syrup light brown soft sugar dark brown soft sugar eggs beaten vanilla extract pecans finely chopped dark chocolate chips bar chopped,1
18,onion olive oil soured cream mayonnaise raw vegetables serve,1
19,brisket boneless light muscovado sugar smoked paprika pinch chilli flakes garlic granules ground cumin dried chipotle chilli beef dripping neutral oil onion sliced carrot chopped garlic clove finely chopped thyme sprig bay leaf star anise lemon zested good beef stock plain flour butter honey snipped chives soured cream cr fra che lemon juiced jacket potatoes buttered kale,1
20,racks baby back pork ribs cans cola toasted sesame seed optional tomato ketchup soft brown sugar soy sauce worcestershire sauce sweet chilli sauce paprika pot halffat soured cream salad cream bunch chive snipped spring onions sliced,1
21,vegetable oil onion finely chopped red peppers yellow peppers finely chopped garlic cloves crushed minced beef x cans chopped tomatoes chipotle smoky barbecue sauce cheese slices burger buns crispy onions serve iceberg lettuce serve,1
22,butter softened room temperature soft brown sugar vanilla extract plain flour fullfat milk,1
23,tbone steak garlic cloves bashed pack thyme olive oil butter,1
24,dried sour cherries bourbon cinnamon maple syrup rashers smoked streaky bacon favourite brownie mixture see goes well bestever brownies recipe little cocoa powder dusting,1
25,olive oil garlic cloves crushed smoked paprika pork loin steaks quartered x cans cannellini beans drained rinsed passata chipotle paste dark soft brown sugar ham hock shreds slices crusty white bread handful flatleaf parsley roughly chopped,1
26,olive oil ground cumin bay leaf garlic cloves crushed shallots chopped red chilli chopped celery stick chopped ripe tomatoes roughly chopped egg yolks oyster sauce slices bread made crumbs soaked little water goodquality beef mince lean slices gruy res optional burger buns warmed little butter goodquality mayonnaise squeezy mustard beef tomato sliced cooked rashers streaky bacon little gem lettuce leaves guacamole see goes well gherkins,1
27,butter plus extra tin digestive biscuits made fine crumbs add extra biscuits like thicker base sugar granulated golden caster philadelphia cheese fullfat soft cheese golden caster sugar plain flour vanilla extract finely grated zest lemon lemon juice eggs plus yolk carton soured cream carton soured cream golden caster sugar lemon juice,1
28,boneless pork shoulder skin removed olive oil spanish paprika piment n mustard powder garlic salt onion salt liquid smoke optional see tip brioche buns see goes well tangy cabbage slaw homemade chipotle molasses bbq sauce see recipes goes well sweetandsour pickled cucumbers jar sliced,1
29,butter softened peanut butter light brown sugar golden caster sugar egg vanilla extract plain flour chopped peanuts bicarbonate soda heaped raspberry jam,1
30,baby gem lettuces leaves separated avocado stoned sliced plum tomatoes chopped rashers cooked crispy bacon cooked turkey breast chicken cut bitesized pieces hardboiled eggs chopped chunks buttermilk light mayonnaise white wine vinegar chopped dill garlic clove crushed,1
31,malted milk biscuits squares milk chocolate marshmallows vegetarian brand required,1
32,big potato cut thin chips olive oil cajun seasoning heaped mayonnaise chopped chive dijon mustard slices white brown bread lightly toasted radishes thinly sliced baby avocado sliced slices salt beef couple little gem lettuce leaves,1
33,skinless chicken breasts garlic cloves crushed paprika juice lemon olive oil corn cobs little gem lettuces quartered lengthways cucumber diced,1
34,fat sausages sweet chilli get onions red white one sweet chilli sauce tomato pur e hot dog buns,1
35,hob nobs butter melted x condensed milk used nestl egg yolks finely grated zest juice limes double cream icing sugar extra lime zest decorate,1
36,crispy chicken thighs sliced see tip light mayonnaise juice lemon worcestershire sauce parmesan grated plus extra serve optional garlic clove crushed cro ton cos lettuce little gem ripped pieces,1
37,racks pork spare ribs single pork spare ribs onion diced olive oil garlic clove crushed smoked paprika mild chilli powder tomato passata tomato pur e cider white red wine vinegar dark muscovado sugar new potatoes skin olive oil rosemary sprigs finely chopped pinch mixed dried herbs white red wine vinegar,1
38,salted pretzel boneless skinless chicken thighs flour dusting eggs beaten fork olive oil wholegrain mustard honey white wine vinegar green veg salad potatoes serve optional,1
39,dark chocolate broken chunks milk chocolate broken chunks pack salted butter soft light brown sugar eggs plain flour cocoa powder raspberries,1
40,slices pancetta serve optional sunflower oil butter cooking blueberries serve optional selfraising flour baking powder caster sugar eggs maple syrup plus extra serve milk,1
41,butter softened caster sugar egg vanilla extract selfraising flour custard powder white chocolate chopped chunks,1
42,white cabbage shredded onion finely sliced celery sticks sliced granny smith apples quartered cored thinly sliced white wine vinegar pot fatfree greek yogurt cooked chicken breasts thinly sliced plain flour egg beaten garlic herb dried breadcrumb frozen corn cobs barbecue sauce serve,1
43,chipolatas green peppers sliced onion cut wedges garlic cloves unpeeled pack readymade cheese sauce hot dog buns used submarine rolls,1
44,plain flour onion cut slices rings separated egg whites olive oil greasing cajun seasoning breadcrumb,1
45,garlic cloves crushed olive oil cider vinegar paprika worcestershire sauce celery salt pepper sauce used franks hot sauce honey chicken wing halved joint,1
46,butter pack peanut cookies gelatine leaves tub ricotta smooth peanut butter golden syrup milk pot double cream soft brown sugar bar peanut brittle crushed,1
47,spare ribs cut individual ribs barbecue spice mix tomato ketchup chilli ketchup soy sauce runny honey teriyaki sauce bourbon whiskey,1
48,onion finely chopped leek green white parts separated sliced carrots chopped pints pints lowsodium chicken vegetable stock potato diced frozen sweetcorn white crabmeat drained light cr fra che chopped chives,1
49,butter room temperature plus extra pan light brown sugar egg yolks vanilla extract plain flour baking powder chocolate chips cookie fillings pretzels chopped nuts pieces fudge toffee marshmallows vanilla ice cream serve optional,1
50,cornflour juice oranges zest caster sugar ripe peaches blueberry selfraising flour butter cut pieces plus melted light muscovado sugar ground cinnamon milk,1
51,butter melted plus extra tin fine polenta plain flour baking powder sugar buttermilk semiskimmed milk squeeze lemon juice eggs beaten bacon lardons onion chopped celery sticks chopped garlic clove crushed dried apricots halved pecans chopped ground nutmeg pork mince thyme leaves chopped dried cranberries,1
52,chicken drumsticks barbecue sauce carrot grated white cabbage shredded red onion thinly sliced salad cream crusty bread serve,1
53,skinless boneless chicken breast fillets paprika dried onion flakes cayenne pepper dried thyme sunflower oil tub guacamole serve,1
54,crunchy peanut butter bar dark chocolate broken pieces soft light brown sugar eggs selfraising flour,1
55,sweetcorn black beans drained rinsed avocado cut chunks cherry tomatoes halved spring onions roughly chopped feta cheese crumbled lime wedges serve optional ground cumin chipotle tabasco sauce use regular tabasco cant find juice zest limes sherry vinegar extravirgin olive oil,1
56,butter hot sauce tabasco sauce crystal white wine vinegar chicken wings celery salt optional flour dusting sunflower oil frying celery sticks serve buttermilk soured cream blue cheese crumbled garlic clove crushed sweet paprika,1
57,x packs pork spare ribs bunch spring onions roughly chopped green stems scotch bonnet chilli seeded finely chopped garlic cloves roughly chopped appleton rum demerara sugar dark soy sauce clear honey dijon mustard ground allspice,1
58,butter onion chopped corn sliced cobs pinch sugar good grating nutmeg,1
59,chunk butternut squash pumpkin vegetable sunflower oil light muscovado sugar tub mascarpone freshly grated nutmeg heaped ground cinnamon heaped ground ginger eggs maple syrup plus serve vanilla extract x packs chilled dessert pastry plain flour rolling milk brushing handful pecan halves roughly chopped icing sugar whipped cream serve,1
60,goodquality pork sausages sunflower oil onions thinly sliced yellow black mustard seeds maple syrup partbaked mini baguettes cut french stick pieces dijon mustard pinch brown muscovado sugar wine cider vinegar,1
61,skinless boneless chicken breasts rashers bacon optional burger buns sliced half lettuce tomato red onion serve tomato ketchup brown sauce splash chilli sauce optional clear honey garlic cloves crushed,1
62,olive oil skinless chicken breasts cut chunky pieces onion chopped celery sticks sliced bay leaves plain flour cajun spice mix paprika ground cumin ground chilli dried basil chicken stock made stock cubes green peppers deseeded cut chunks thickly sliced ham trimmed fat diced spring onions sliced roughly chopped parsley,1
63,dots butter shortcrust pastry bought homemade little flour dusting dried white breadcrumb good cumberland sausage smoked bacon lardon ground mace ground pepper dried sage egg beaten fork pinches sesame seeds piccalilli homemade bought serve,2
64,plain flour eggs milk dijon mustard vegetable oil cumberland sausages sage leaves rosemary sprigs,2
65,celery sticks sliced pieces onion chopped really big carrots halved lengthways chunkily sliced bay leaves thyme sprigs vegetable oil butter plain flour tomato pur e worcestershire sauce beef stock cubes crumbled feather blade beef braising cut cut chunks potato mature cheddar parmesan finely grated,2
66,pack allbutter puff pastry selfraising flour plus extra dusting rounded morello cherry jam plain sponge madeira cake butter softened ground almond golden caster sugar eggs almond extract flaked almond icing sugar sieved decorate,2
67,raspberry plus extra serve blackberry plus extra serve redcurrant plus extra serve strawberry hulled quartered golden caster sugar plus bit extra optional brioche loaf clotted cream serve optional,2
68,black peppercorn english mustard powder dried thyme celery seeds olive oil topside joint beef plain flour beef stock cubes caramelised onion chutney marmalade marmite,2
69,goodquality white bread garlic cloves zest lemon thyme leaf chopped bunch parsley chopped anchovy fillets chopped optional carrots cut chunks onions cut chunks bay leaves bunch rosemary olive oil leg lamb garlic cloves thickly sliced plus whole bulb halved plain flour white wine plus splash lamb stock,2
70,milk eggs plain flour sunflower vegetable oil,2
71,light digestive biscuit cornflake butter melted caster sugar egg plus egg yolks light condensed milk zest juice lemons zest juice oranges pot extrathick double cream fat greek yogurt icing sugar lemon orange zest decorate,2
72,onion chopped smoked bacon lardons olive oil lean stewing beef cubed plain flour parsnips cubed brown ale beef stock cranberry redcurrant jelly thyme sprigs greens serve optional butter greasing selfraising flour plus extra dusting english mustard powder shredded suet,2
73,langoustine dublin bay prawn tails vegetable sunflower oil frying plain flour cornflour beer sparkling water lemon wedges chips serve mayonnaise gherkin cornichons finely chopped caper rinsed chopped lemon juice chopped parsley chopped tarragon,2
74,golden syrup zest lemon plus juice lemon breadcrumb pack butter softened golden caster sugar eggs selfraising flour milk,2
75,eggs goodquality cumberland lincolnshire sausages skinned curly parsley finely chopped worcestershire sauce english mustard powder ground mace rashers smoked streaky bacon plain flour dried breadcrumbs pints sunflower vegetable oil frying scraps bread testing oil,2
76,butter pears cored halved rhubarb cut chunks soft light brown sugar ground cinnamon ground cloves vanilla ice cream double cream serve roasted hazelnut cold butter diced selfraising flour ground cinnamon demerara sugar,2
77,butter softened bunch fresh thyme lemon thyme leaves picked stalks reserved plus extra serve garlic cloves mashed left whole squashed lemons halved chicken carrots roughly chopped onion roughly chopped bay leaves plain flour chicken stock splash soy sauce optional,2
78,leftover dried fruit like raisins sultanas currants eating apples pears cored grated demerara sugar plus little extra decorate leftover marzipan grated ground cloves ground cinnamon block puff pastry little flour rolling egg beaten,2
79,lambs kidneys halved rapeseed oil onions chopped bay leaves thyme sprigs lean stewing steak cut chunks red wine tomato pur e english mustard powder plain flour carrot chopped flat mushrooms quartered halved chopped parsley plain flour plus extra dusting thyme leaves optional cold frozen butter fat greek yogurt extravirgin olive oil,2
80,streaky steaks strips pork belly rind trimmed sunflower vegetable oil pack pork sausages try cumberland garlic sageflavoured lincolnshire varieties back bacon chops cannellini haricot butter mixed beans drained onion chopped carrots thickly sliced chopped tomatoes bouquet garni tea bag chicken stock stock cube fine fresh white breadcrumbs garlic cloves,2
81,sunflower oil onion chopped carrots chopped pack lamb mince tomato pur e splash worcestershire sauce beef stock potatoes cut chunks butter milk,2
82,gammon ham hock split peas soaked overnight onions roughly chopped carrots roughly chopped bay leaves stick celery roughly chopped frozen peas crusty bread butter serve,2
83,vegetable oil skinless boneless chicken thighs rashers smoked streaky bacon cut pieces onion halved sliced baby button mushrooms handful thyme sprigs plain flour chicken stock milk pack fresh puff pastry frozen defrosted egg beaten,2
84,skinless white fish fillet skinless smoked haddock fillet fullfat milk onion quartered cloves bay leaves eggs bunch parsley leaves chopped butter plain flour pinch freshly grated nutmeg floury potato peeled cut evensized chunks cheddar grated,2
85,unsalted butter softened plus extra greasing caster sugar vanilla extract eggs selfraising flour plus extra dusting raspberry jam double cream whipped icing sugar dusting,2
86,good beef fillet preferably aberdeen angus around olive oil chestnut mushroom include wild ones like butter sprig fresh thyme fl dry white wine slices prosciutto pack puff pastry thawed frozen little flour dusting egg yolks beaten water,2
87,sunflower oil onion chopped garlic cloves crushed knob ginger peeled granted curry powder minced beef lamb chopped tomato frozen pea parsnip peeled chopped chunks potato peeled chopped chunks green chilli deseeded chopped bunch coriander chopped turmeric juice lemon butter,2
88,tub whipping cream caster sugar white wine zest juice lemon almond thins berries serve,2
89,dripping butter stewing lamb cut chunks lamb kidneys sliced fat removed onions chopped carrots peeled sliced plain flour worcestershire sauce lamb chicken stock bay leaves potato peeled sliced,2
90,ripe english pear peeled cubed golden granulated sugar blackberry plain flour unsalted butter cold cut pieces shelled pistachio roughly chopped demerara sugar ice cream serve optional,2
91,butter short grain pudding rice fullfat milk pot double cream tub clotted cream split vanilla pod golden caster sugar freshly grated nutmeg,2
92,floury potatoes cut chunks cumberland sausages butter onion thinly sliced plain flour beef stock apples peeled chopped chunks milk,2
93,rashers goodquality lean unsmoked back bacon browncap portabello mushrooms cherry tomatoes vine room temperature olive oil slices granary wholegrain bread cut diagonal goodquality freerange pork sausages minimum pork freerange rich eggs room temperature drops cider vinegar x fl glasses freshlysqueezed orange juice plus orange cut wedges handful fresh blueberries,2
94,fresh cranberries frozen thawed icing sugar cranberry sauce jelly selfraising flour plus extra dusting dried suet caster sugar finely grated zest orange milk custard serve,2
95,diced butter selfraising flour salt bicarbonate soda caster sugar milk warmed room temperature plus splash extra crushed sugar cubes decorate,2
96,butternut squash weight red onion olive oil sprig fresh sage courgette balsamic sherry vinegar lancashire cheese,2
97,freshly squeezed orange juice freshly squeezed lime juice goodquality golden rum sugar syrup dash grenadine syrup dash angostura bitters ice cubes serve generous pinch freshly grated nutmeg thick slices orange garnish maraschino cherries garnish,3
98,drizzle oil onion finely chopped garlic cloves crushed beef mince potato cut cubes turmeric tomato pur e thyme sprigs hot pepper sauce block shortcrust pastry egg beaten green salad serve,3
99,heaped jamaican jerk paste clear honey salmon fillets juice limes red cabbage core removed thinly sliced firm ripe mango skin removed thinly sliced red pepper thinly sliced spring onions thinly sliced angle bunch coriander leaves picked,3
100,chicken thighs bone lime halved hot sauce serve optional big bunch spring onions roughly chopped thumbsized piece ginger roughly chopped garlic cloves onion scotch bonnet chillies deseeded want less heat dried thyme thyme leaves lime juiced soy sauce vegetable oil brown sugar ground allspice basmati rice coconut milk bunch spring onions sliced thyme sprigs garlic cloves finely chopped ground allspice x cans kidney beans drained,3
101,onions diced roughly chopped sunflower oil ginger roughly chopped bunch coriander leaves stalks separated jerk seasoning thyme sprigs chopped tomato red wine vinegar demerara sugar vegetable stock cubes crumbled sweet potato peeled cut chunks x cans black beans rinsed drained jar roasted red pepper cut thick slices,3
102,onion roughly chopped garlic cloves ginger chopped vegetable oil scotch bonnet chillies chopped handful curry leaves thyme sprigs mild curry powder mutton goat shoulder diced chopped tomato lamb beef stock pinto kidney blackeyed beans juice lemon bunch coriander chopped warmed roti jamaican flatbread rice serve,3
103,potatoes vegetable oil red onion grated finely chopped carrot grated beef mince jerk seasoning used bart fresh pineapple used precut packet finely chopped red chilli deseeded finely chopped handful coriander roughly chopped juice lime lettuce burger buns serve,3
104,zest juice lime clear honey pinches ground cinnamon gratings whole nutmeg icing sugar sifted lowfat fromage frais butter fresh pineapple cut long wedges skin core removed,3
105,passion fruits banana chopped mango peeled stoned chopped orange juice ice cubes,3
106,jerk seasoning used bart olive oil juice lime skinless chicken breasts chopped chunks yellow pepper cut cubes bag rocket leaves serve pack mango chunks diced red pepper deseeded diced bunch spring onions finely chopped red chilli chopped optional,3
107,olive oil red onion diced scotch bonnet chilli deseeded finely chopped chopped tomato x bottle levi roots love apple tomato sauce tomato sauce good splash tabasco allspice x bags tortilla chip jar sliced jalapeno chilli x balls mozzarella torn handful coriander chopped tub fresh guacamole x pot soured cream,3
108,sunflower oil bunch spring onions whites greens separated sliced red pepper diced scotch bonnet chilli deseeded pounded paste garlic clove chopped dried thyme curry powder allspice plum tomatoes chopped vegetable stock cube kidney bean rinsed drained pinto bean rinsed drained blackeyed bean rinsed drained x cans coconut milk juice limes,3
109,limes juice grated zest halved serving skinned white fish fillets cod hoki lemons juice x packets fresh thyme need lot aroma white pepper dark rum vegetable oil onion cut thin rings handful fresh coriander chopped garlic cloves chopped beefsteak normal tomatoes sliced dark muscovado sugar shake angostura bitters optional basmati rice boiled potatoes steamed vegetables serve,3
110,sweet potatoes olive oil fresh thyme leaves plus sprigs fresh thyme red scotch bonnet chilli seeded finely chopped,3
111,ripe plantains skins must black butter demerara sugar freshly squeezed orange juice,3
112,olive oil jamaican jerk sauce boneless pork loin steaks total chicken stock cube creamed coconut block bunch salad onions x packets rizzazz pure basmati rice ready cooked rice vacuumpack red kidney beans drained,3
113,x packs pork spare ribs bunch spring onions roughly chopped green stems scotch bonnet chilli seeded finely chopped garlic cloves roughly chopped appleton rum demerara sugar dark soy sauce clear honey dijon mustard ground allspice,3
114,pumpkin seeds ripe papaya ripe avocado bag trimmed washed watercress half pack fresh mint juice half lime olive oil,3
115,sea salt dark muscovado sugar piece boned shoulder pork trimmed rind leave fat jerk seasoning used bart mixed ground cinnamon pineapple juice treacle x cans black beans drained rinsed well lots soft flour tortillas per person depending size appetites big pot natural yogurt shredded lettuce serve optional bananas firm ripe peeled cut cubes red onion finely diced justripe avocados juice lemon juice limes red chillies deseeded diced pack coriander stalks finely chopped leaves roughly chopped,3
116,raw peeled king prawn jamaican jerk paste black bean drained rinsed mango stoned peeled diced red onion sliced cucumber chopped bunch coriander leaves roughly chopped taco shells vegetable oil little gem lettuces shredded coconut milk zest juice lime pinches sugar,3
