,Ingredients,Cuisine
221,pot double cream green blacks white chocolate broken pieces vanilla pod split vanilla extract egg yolks golden caster sugar plus extra topping,5
222,white wine vinegar peppercorn bunch tarragon freerange egg yolks melted skimmed unsalted butter see secrets success squeeze lemon juice,5
223,roasted chicken room temperature hearts romaine lettuces tomatoes spring onions ripe avocados lemon juice plus extra squeezing packet feta cheese dried oregano dried mint half bunch flatleaf parsley extravirgin olive oil black kalamata olives pitta bread serve optional,6
224,bag spinach leaves jar sundried tomato oil feta cheese crumbled eggs filo pastry,6
225,fresh white breadcrumbs lamb mince egg beaten onions halved handful mint chopped potatoes cut wedges courgettes cut batons cherry tomatoes olive oil feta cheese crumbled,6
226,eggs handful parsley leaves chopped optional olive oil red onion cut wedges tomatoes chopped chunks handful black olives pitted easier eat feta cheese crumbled,6
227,pack lean minced beef aubergine pot greek yogurt egg beaten parmesan finely grated chopped tomato garlic herbs sundried tomato pur e leftover boiled potato uncooked weight boiled,6
228,lamb cutlets chops zest juice lemons sprigs thyme leaves stripped plus extra serve like garlic cloves crushed greek yogurt houmous pitta bread bag salad leaves serve,6
229,beef tomatoes pinch sugar greek extra virgin olive oil plus extra drizzle spanish onion finely chopped garlic cloves finely chopped minced lamb ground cinnamon tomato pur e long grain rice chicken stock chopped dill chopped flatleaf parsley chopped mint,6
230,courgettes red onion low fat halloumi cheese cut chunks used cypressa halloumi lite cherry tomatoes olive oil lemon juice fresh thyme leaves preferably lemon thyme dijon mustard pitta bread serve,6
231,lamb mince ground coriander cumin seeds red chilli deseeded finely chopped handful parsley chopped rosemary sprigs leaves stripped chopped good splash worcestershire sauce egg lightly beaten fork feta cheese cut cubes sunflower oil natural yogurt bunch mint leaves chopped,6
232,spring greens finely shredded stalks butter olive oil leeks halved cleaned finely sliced garlic cloves crushed pack parsley chopped pack mint chopped pack dill chopped nutmeg finely grated ricotta pecorino parmesan vegetarian alternative finely grated eggs beaten lemon zested pack filo pastry sesame seeds used mixture black white,6
233,olive oil onion chopped plump garlic cloves finely chopped carrots total weight diced fat minced beef white wine ground cinnamon plus extra ground allspice plum tomatoes tomato pur e chopped oregano leaves good handfuls chopped flatleaf parsley plus extra garnish aubergines total weight ends trimmed lemon juice eggs cornflour greek yogurt parmesan grated halved cherry tomatoes thinly sliced red onion rocket salad,6
234,garlic cloves finely chopped sea salt olive oil zest juice lemon finely chopped fresh dill lean lamb neck fillet boneless leg trimmed cut chunks pitta bread flatbread serve,6
235,shoulder lamb olive oil oregano sprigs leaves stripped rosemary sprigs leaves stripped garlic cloves roughly chopped red wine x cans chopped tomatoes caster sugar,6
236,vine tomatoes cut irregular wedges cucumber peeled deseeded roughly chopped red onion thinly sliced kalamata olives dried oregano feta cheese cut chunks barrel matured feta best greek extra virgin olive oil,6
237,butter melted plus extra greasing cups clear honey plus extra drizzling selfraising flour ground almond light muscovado sugar bicarbonate soda egg greek yogurt take tub ice cream pistachios roughly chopped,6
238,watermelon peeled deseeded cut chunks block feta cheese cubed handful black olives handful flatleaf parsley mint leaves roughly chopped red onion finely sliced rings olive oil balsamic vinegar serve pack white bread mix olive oil plus little extra drizzling plain flour dusting egg white beaten mix sesame seeds poppy seeds fennel seeds scattering,6
239,rack lamb trimmed fat cut two racks thyme sprigs left whole plus extra sprigs serve extravirgin olive oil plus extra frying drizzling zest lemon garlic cloves crushed dried oregano pack flatleaf parsley fat regular garlic cloves crushed cherry tomatoes feta cheese finely crumbled zest lemon pinch dried oregano slice white bread use dayold whizzed crumbs,6
240,x cans butter beans dried butter beans cook according pack instructions greek extra virgin olive oil red onions finely sliced carrots finely sliced celery stalks leaves finely chopped sundried tomatoes sliced ripe tomatoes skinned deseeded finely chopped garlic cloves chopped paprika ground cinnamon tomato pur e sugar pack flatleaf parsley finely chopped pack dill finely chopped feta optional crumbled,6
241,olive oil onion finely chopped garlic cloves finely chopped minced lamb chopped plum tomatoes tomato pur e ground cinnamon jar chargrilled aubergines olive oil drained chopped pack feta cheese crumbled fresh mint chopped,6
242,smoked salmon lowfat soft cheese cr fra che juice lemon drizzle olive oil serve black kalamata olive toasted pitta bread serve,6
243,dried porcini mushrooms olive oil plus extra drizzling pickling onions mixed mushrooms oyster cep chestnut morel portobello garlic cloves finely chopped dry red wine tomato pur e red wine vinegar bay leaves whole allspice berries cinnamon sticks whole cloves black peppercorns tomatoes peeled finely chopped kalamata black olive pitted chopped greek clear honey chopped flatleaf parsley vegetarian kefalotyri pecorino grated optional horseradish mash see goes well serve,6
244,garlic cloves roughly chopped oregano roughly chopped rosemary zest lemon juice ground cinnamon olive oil leg lamb desiree potato halved quartered bay leaves greek yogurt juice lemon olive oil handful mint shredded red wine vinegar extravirgin olive oil baby spinach bunch parsley roughly chopped red onion finely sliced cherry tomatoes halved cucumber halved lengthways deseeded sliced black kalamata olives stoned quartered,6
245,olive oil frying lamb mince onions finely chopped garlic cloves chopped x cans cherry tomatoes thick juice bay leaves cinnamon stick dried oregano pinch sugar aubergines potatoes x cans artichoke hearts drained really well see tip butter plain flour milk generous grating nutmeg grated gruy grated parmesan eggs lightly beaten,6
246,potatoes scrubbed cut wedges onion halved sliced garlic cloves roughly chopped dried oregano chopped fresh oregano olive oil lemon cut wedges tomatoes cut wedges fresh skinless pollock fillets handful parsley roughly chopped,6
247,olive oil aubergines cut rounds lamb mince onion finely chopped fat garlic cloves crushed heaped dried oregano ground cinnamon bay leaves red wine chopped tomatoes tomato pur e light brown soft sugar maris piper potatoes peeled sliced rounds unsalted butter plain flour whole milk parmesan finely grated whole nutmeg grating egg plus yolk lightly beaten,6
248,mediumsize potatoes skin thinly sliced tomatoes thinly sliced aubergine thinly sliced garlic cloves chopped oregano leaves plus extra sprinkling pitted kalamata olives halved olive oil plus drizzle feta cheese crumbled lamb steaks,6
249,brown basmati rice lamb mince harissa feta cheese red onion thinly sliced grated handful parsley roughly chopped handful mint roughly chopped pitted black kalamata olive quartered cucumber diced cherry tomato halved olive oil juice lemon,6
250,olive oil lamb meatballs baby new potatoes thickly sliced garlic cloves crushed chargrilled vegetables drained oil x cans chopped tomatoes herbs light brown soft sugar black olives feta crumbled bunch mint finely shredded lemon zested,6
251,bulghar wheat extralean lamb mince ground cumin ground coriander smoked paprika garlic clove finely crushed optional oil brushing burger buns sliced tomato red onion serve piece cucumber deseeded coarsely grated pot thick greek yogurt chopped mint plus handful leaves serve,6
252,quinoa butter red chilli deseeded finely chopped garlic clove crushed chicken mini fillets extravirgin olive oil vine tomato roughly chopped handful pitted black kalamata olive red onion finely sliced feta cheese crumbled bunch mint leaves chopped juice zest lemon,6
253,cucumber halved deseeded pot greek yogurt garlic clove crushed handful mint leaves chopped,6
254,olive oil onion chopped garlic cloves crushed lean lamb mince ground cinnamon beef lamb stock cube x cans chopped tomatoes dried oregano macaroni tub ricotta parmesan grated milk garlic bread serve optional,6
255,shoulder lamb garlic bulb cloves separated skin left anchovies olive oil tomatoes left whole carrots peeled left whole handful fresh sage handful fresh rosemary handful fresh thyme tzatziki chickpea salad flatbreads serve,6
256,lamb fillet olive oil garlic cloves crushed onion chopped tomato pur e bunch dill chopped red wine vinegar chicken stock x cans gigante butter beans drained crumbled feta cheese,6
257,olive oil fresh thyme leaves plus extra scattering garlic cloves sliced dried chilli flakes semidried tomato olive oil drained pack jar artichoke heart oil x packs feta cheese kalamata olive,6
258,garlic cloves olive oil juice lemon dried oregano thyme leaf bay leaves leg lamb butterflied see step step guide flatbreads serve cucumber halved deseeded pot greek yogurt garlic clove crushed handful mint leaves chopped,6
259,juice lemon olive oil garlic clove crushed diced lamb leg tomatoes chopped cucumber chopped handful black olives roughly chopped pack feta cheese crumbled bunch mint chopped,6
260,cumin seed coriander seed block feta cheese use light prefer halved little olive oil handfuls mixed salad leaves handful flatleaf parsley roughly chopped mint sprigs leaves picked pitta breads quartered pack watermelon chunks equivalent whole chunk chopped pieces juice limes red chilli finely chopped red onion finely chopped,6
261,floury potatoes maris piper cut evensized chunks garlic cloves extra virgin olive oil red wine vinegar black green olive tapenade,6
262,dried butter beans greek extra virgin olive oil plus serve spanish onion finely chopped garlic cloves finely chopped tomato pur e ripe tomatoes skins removed roughly chopped sugar dried oregano pinch ground cinnamon chopped flatleaf parsley plus extra serve,6
263,boneless skinless chicken thighs olive oil dried oregano dried mint ground cumin coriander sweet paprika ground cinnamon zest juice lemon plus lemon cut wedges serve garlic cloves crushed strong white bread flour sachet fastaction dried yeast golden caster sugar olive oil plus little greasing cucumber greek yogurt bunch mint finely chopped garlic clove crushed juice lemon butter round lettuce tomatoes seeds removed chopped red onion halved thinly sliced long metal skewers,6
264,leg lamb garlic cloves bunch oregano zest juice lemon olive oil new potatoes chopped tomato handful pitted baby kalamata olives,6
265,shoulder lamb onions sliced chopped oregano dried ground cinnamon cinnamon sticks broken half olive oil chopped tomato hot lowsodium chicken vegetable stock orzo see knowhow freshly grated parmesan serve,6
266,fusilli pasta spirals use farfalle butterflies penne quill tubes bag prepared fresh baby spinach punnet cherry tomatoes halved black olive bought kalamata deli counter feta cheese broken rough chunks olive oil,6
267,mediumsized potatoes olive oil plus extra brushing red onion sliced lamb mince garlic cloves crushed mixed spice carton passata aubergines cut slices tub cr fra che cheddar grated,6
268,olive oil skinless chicken breasts chopped chunks skinless boneless chicken thighs chopped chunks onions sliced curry paste used korma tikka masala cauliflower chopped florets chicken stock chopped tomato chickpea rinsed drained natural yogurt spinach basmati rice cooked following pack instructions flaked almond,7
269,sweet potatoes cut chunky wedges red chilli finely chopped olive oil cumin seeds garam masala red onion thinly sliced juice lime sugar chapatis natural yogurt bunch coriander,7
270,charlotte new potato unpeeled halved sunflower oil pinch asafoetida available bart steenbergscouk see tip black mustard seeds cumin seeds dried red chillies fresh red green chilli deseeded thinly sliced pointed sweetheart cabbage finely shredded juice lemon desiccated shaved fresh coconut toasted bunch coriander roughly chopped,7
271,sprouting broccoli vegetable oil pinch asafoetida cumin seed sesame seeds green chilli finely chopped brown mustard seeds curry leaves onion sliced paneer cheese cut strips grated ginger garlic cloves crushed lemon juice ground mace,7
272,vegetable oil cumin seeds red chillies deseeded chopped clove cinnamon stick bay leaf onion finely chopped ground turmeric garlic cloves finely chopped chickpeas rinsed drained paprika ground coriander tomatoes chopped chopped coriander,7
273,vegetable oil onion finely chopped cardamom pods bashed ground cumin coriander ground turmeric green chilli deseeded desired finely chopped garlic clove crushed thumbsize piece ginger finely chopped mixed vegetable carrots cauliflower potato courgette chopped hot vegetable stock frozen peas yogurt ground almonds optional raw chicken breast per portion toasted flaked almonds chopped coriander basmati rice naan bread,7
274,lamb cutlets tub natural yogurt ground coriander turmeric bunch coriander chopped juice zest lemon naan bread serve chunk squash peeled chopped pieces sunflower oil onions chopped thumbsize piece ginger chopped green chilli halved black brown mustard seeds ground coriander turmeric cornflour caster sugar cider vinegar,7
275,potato diced butternut squash peeled deseeded diced aubergine diced tikka masala paste vegetable oil onions sliced jar tomato passata coconut milk red peppers sliced courgettes diced coriander sprigs serve rice naan bread serve,7
276,drizzle olive oil frying sea bream fillets garlic paste blend lots peeled garlic little vegetable oil freeze ice cube trays ginger paste made green chillies red chilli powder turmeric garam masala juice lime unsalted butter,7
277,fat greek yogurt masala paste handful coriander leaves chopped plus extra leaves serve juice lime pinch zest plus wedges serve skinless boneless chicken breasts cut chunks wholemeal chapatis serve pack cherry tomatoes hulled quartered red onion finely chopped cucumber cut chunks,7
278,red onions chickpea flour flour baking powder curry paste powder red green chilli deseeded finely chopped vegetable oil frying tub natural yogurt chopped mint garlic clove crushed,7
279,sunflower oil onions sliced curry paste choice basmati rice cauliflower florets chickpeas rinsed drained vegetable stock toasted flaked almonds handful chopped coriander,7
280,mangoes peeled stoned finely chopped green cardamom pods seeds removed finely grated zest juice limes icing sugar brandy pot double cream meringues shells lightly crushed mint sprigs serve,7
281,tin condensed milk rosewater finely chopped pistachio plus roughly chopped pistachios serve tub double cream ripe mangoes,7
282,eggs onion finely sliced vegetable oil korma paste green bean trimmed halved young leaf spinach cherry tomato reducedfat coconut milk,7
283,x sachet coconut cream greek yogurt tub quark icing sugar sieved drops vanilla extract kiwi fruit pineapple chunks,7
284,garlic cloves crushed thumbsized piece ginger finely grated turmeric leg lamb bone cut bitesized pieces vegetable oil curry leaves onion finely chopped lamb stock potato peeled cut chunks coconut milk tamarind paste rice roti serve coriander seeds fennel seeds cumin seeds dried kashmiri chillies mild dried red chillies stalks removed,7
285,skinless boneless chicken breast cut bitesized pieces lime juice paprika hot chilli powder sunflower groundnut oil cinnamon stick cardamom pods split green chilli cumin seed onion coarsely grated garlic cloves finely chopped cmpiece ginger grated turmeric ground cumin ground coriander garam masala organic passata red pepper deseeded cut chunks tomato chopped baby spinach leaves handful fresh coriander chopped chapatis basmati rice serve optional,7
286,vegetable oil onions finely chopped yellow mustard seed madras curry paste peeled weight raw beetroot peeled halved thickly sliced green chilli halved lengthways chopped tomato ground almond lowfat natural yogurt plus extra serve basmati rice serve optional,7
287,side salmon skin olive oil plus extra brushing ground ginger paprika coarsely ground black peppercorns wholegrain mustard honey lemon cut wedges serve,7
288,thumbsized piece ginger grated garlic cloves vine tomatoes halved deseeded chopped new potatoes halved sunflower oil onion thinly sliced green chillies halved deseeded thinly sliced black mustard seeds ground coriander turmeric ground cumin garam masala bunch coriander chopped,7
289,eggs lamb mince garlic cloves crushed bird eye chillies finely chopped handful coriander roughly chopped ground cumin chilli flakes garam masala ground coriander vegetable oil plus extra deepfrying potato peeled boiled mashed fork leftover mash chutney serve optional plain flour eggs beaten panko breadcrumbs seasoned salt,7
290,selfraising flour plus extra dusting bunch fresh fenugreek coriander finely chopped lukewarm milk sunflower oil deepfrying black looseleaf tea brewed litre hot water x cans chickpeas drained rinsed ghee onions finely chopped cumin seeds black cardamom pods bruised thumbsized piece ginger peeled grated garlic cloves finely chopped green chillies finely chopped ground cinnamon ground fenugreek ground coriander ground ginger kashmiri chilli powder anardana tomatoes finely chopped tomato pur e turmeric kala namak coarsely ground black pepper sliced red onion yogurt serve bunch coriander leaves picked plus extra serve,7
291,split urad lentils washed channa dal bengal basmati rice fenugreek seeds optional vegetable oil frying,7
292,raw king prawns turmeric kashmiri chilli powder lemon juice plus squeeze ginger half peeled grated half finely sliced matchsticks vegetable oil curry leaves green chillies halved deseeded onion finely sliced cracked black pepper fresh coconut grated bunch coriander leaves,7
293,coconut oil used fushi sunflower oil onion finely chopped fat garlic cloves crushed fresh ginger grated finely chopped ground coriander yellow mustard seed garam masala ground cumin x pack chicken pieces thighs drumsticks thighs chicken stock cube cinnamon stick greek yogurt room temperature sultana handful chopped coriander serve optional,7
294,sunflower oil nigella seeds thumbsized piece ginger grated garlic cloves grated pumpkin butternut squash peeled chopped cubes cabbage chopped sweetheart pointed cabbage works well turmeric ground coriander ground cumin chilli flakes lime juice dhal chutney rice roti serve optional,7
295,readyroasted chicken x packs mini coriander garlic naan bread yogurt light mayonnaise mild curry powder mango chutney bunch coriander roughly chopped plus extra serve carrots grated red cabbage shredded black mustard seed,7
296,vegetable oil plus onions thinly sliced vine tomatoes roughly chopped garlic cloves thumbsized piece ginger roughly chopped madras curry paste coconut milk handful coriander finely chopped plus extra sprigs serve pollock fillets skinned plain flour basmati rice serve,7
297,tamarind pulp paste golden muscovado sugar ground cumin thumbsized piece ginger chopped new potato natural lowfat yogurt chopped coriander,7
298,garlic cloves roughly chopped thumbsized piece ginger chopped green chillies chopped leave seeds like hot bunch coriander leaves picked stalks roughly chopped ghee vegetable oil onions sliced turmeric garam masala ground cumin ground fenugreek chicken breasts cut cubes cloves cardamom pods seeds removed cinnamon stick tomato pot yogurt double cream chapatis rice serve,7
299,sunflower oil onion thinly sliced freshly grated ginger garlic cloves crushed red chilli deseeded sliced turmeric chilli powder ground coriander curry leaves potato diced halffat coconut milk cherry tomatoes halved handful baby spinach pack raw peeled prawn cumin seed basmati rice,7
300,skinless chicken breasts pot lowfat natural yogurt tikka paste cucumber diced roughly chopped mint leaves red onion cut thin wedges easycook long grain rice curry powder frozen pea red pepper diced,7
301,chicken onions thickly sliced lemon halved thumbsized piece ginger peeled thickly sliced coconut milk bunch coriander roughly chopped pot natural yogurt tomato pur e juice lemon hot chilli powder turmeric ground coriander ground cumin garam masala ground cinnamon garlic cloves whizzed paste ginger fingerlength piece ginger whizzed paste garlic drops red food colouring optional,7
302,tilapia fillets yellow red curry paste desiccated coconut zest juice lime plus wedges serve soy sauce basmati rice sweet chilli sauce red chilli sliced cooked thinstemmed broccoli serve,7
303,tandoori masala powder ginger paste garlic paste pot coconut yogurt plus extra serve onions cut wedges chopped peppers cut chunks skinless chicken thigh cut chunks olive oil big bunch coriander stalks chopped hot chilli powder jar passata coconut cream rice naan bread serve,7
304,juice lemon boneless skinless firm white fish cut pieces vegetable oil cinnamon stick whole cloves green cardamom pods whole black peppercorns fresh curry leaves onions chopped green chillies finely chopped grated ginger garlic cloves finely chopped tomatoes chopped chopped tomatoes turmeric chilli powder ground coriander,7
305,red yellow lentil turmeric tamarind paste vegetable oil shallots finely chopped ground asafoetida ground fenugreek black mustard seeds curry leaves dried red chillies green bean trimmed cut half,7
306,turmeric powder coriander seed mustard seed ground cumin seeds ground fenugreek black peppercorns juice lemons garlic cloves crushed ginger grated coconut milk red chillies deseeded chopped pieces chicken bone skin whole chicken jointed coriander sprigs,7
307,mix vegetables including aubergine carrot okra plantain potato squash prepared appropriately cut chunks turmeric green chillies chopped left whole split lengthways ground cumin ground coriander freshly grated coconut see stepbystep prep guide onion chopped curry leaves plain yogurt,7
308,onion garlic cloves roughly chopped ginger roughly chopped vegetable oil cumin seeds fennel seeds cinnamon stick chilli flakes garam masala turmeric caster sugar chopped tomatoes chicken thighs skinned boneless hot chicken stock chopped coriander,7
309,boneless skinless chicken breasts cubed piece fresh root ginger peeled chopped garlic clove chopped mild chilli powder fresh coriander chopped juice lime vegetable oil onion red chilli ground turmeric carton double cream juice lemon basmati rice naan bread serve,7
310,sunflower oil onions thickly sliced skinless chicken breasts balti curry paste quinoa chopped tomato chicken stock roasted salted cashew bunch coriander leaves chopped,7
311,butterflied leg lamb ask butcher fingerlength piece ginger chopped garlic cloves roughly chopped turmeric garam masala cumin seeds paprika handful coriander leaves plus extra sprigs serve juice lemon natural yogurt,7
312,vegetable oil cumin seed mustard seed green chillies finely chopped piece fresh root ginger grated turmeric shredded greens kale brussels sprouts pea juice lemon ground coriander bunch coriander roughly chopped unsweetened desiccated coconut,7
313,self raising flour wholemeal plain flour salt vegetable oil plus extra frying butter frying,7
314,basmati rice onions halved thinly sliced sunflower oil thumbsize piece fresh root ginger shredded sachet korma curry paste used sharwoods cinnamon sticks green cardamom pods star anise diced potatoes cauliflower cut florets greek yogurt frozen peas good pinches saffron rosewater butter greasing roasted salted cashew nuts onions halved thinly sliced sunflower oil good handful coriander,7
315,red onion sliced beef mince mild curry powder dried red lentils hot beef stock tomatoes handful coriander leaves mini naan bread,7
316,potato quartered cumin seeds spring onions finely chopped red chilli deseeded finely chopped chopped coriander egg beaten cooked leftover salmon flaked pieces plain flour coating butter sunflower oil leftover avocado mayo raita mango chutney serve,7
317,strong white flour salt sachet fastaction yeast olive oil water,7
318,vegetable oil frying paneer cut bitesized pieces coriander seed knob ginger peeled chopped onion chopped ripe tomatoes chopped chilli powder fenugreek seed garam masala clear honey handful fresh coriander chopped knob ginger peeled shredded matchsticks red green pepper seeded finely chopped spring onions finely shredded,7
319,vegetable sunflower oil onions halved thinly sliced undyed smoked haddock lightly smoked salmon fillet dried red chilli angela used kashmiri fullfat milk vegetable sunflower oil onion chopped fresh freezedried curry leaves cardamom pods split cinnamon stick broken pieces basmati rice turmeric butter eggs handful coriander leaves lime wedges serve,7
320,vineripened tomatoes red onion finely chopped fresh coriander finely chopped olive oil cumin seed,7
321,mangoes cointreau grand marnier handful fresh mint leaves,7
322,low fat yogurt water toasted cumin seeds little chopped fresh coriander sugar taste drops rosewater taste,7
323,vegetable oil onion chopped finely grated fresh root ginger garlic clove chopped garam masala vegetable stock carrots quartered lengthways chopped chickpea drained green bean chopped,7
324,parmesan finely grated curry powder used schwartz mild curry powder lamb cutlets olive oil tomato chutney serve,7
325,mugful american long grain rice onions sliced sunflower oil turmeric cinnamon stick cardamom pods cumin seeds handful sultanas roasted cashew nuts,7
326,carrots bunch radishes courgettes half red onion handful mint leaves roughly torn white wine vinegar dijon mustard mayonnaise olive oil,7
